{
  "_comment": [
    "文件名规则:ntrace_<SoC 家族>_v<trace 版本>。本文件 = xiaohui 家族 + trace v2。",
    "",
    "追踪类型(topology_model=chained-dmi):per-core 链式 funnel1 → per-cluster 链式 funnel2;",
    "  节点地址用 DMI 索引寻址 addr = dmi_apb_base + dmi_off * dmi_scale(非绝对 offset)。",
    "  适用:C920v3 / C930 / C925 等二代追踪核(C920v3 在 xiaohui_v1,C930/C925 在 xiaohui_v2,",
    "  同家族同 apb,故共用本文件)。",
    "",
    "地址分配(APB 基址 dmi_apb_base=0x28000000,dmi_scale=4;cluster c、cluster 内核 i 从 0 计):",
    "  cluster 基       = c * cluster_dmi_stride(0x10000)",
    "  encoder{p}       = calc(cluster基 + encoder_dmi_base(0x800) + i*encoder_dmi_core_stride(0x800))",
    "  funnel1_{p}      = calc(cluster基 + funnel1_dmi_base(0xC00) + i*funnel1_dmi_core_stride(0x800))",
    "  funnel2_{c}      = calc(cluster基 + funnel2_dmi_offset(0x400))",
    "  sink(smem)       = calc(cluster_dmi_stride*n_clusters + sink_dmi_offset.smem 0x400)",
    "    · 部分写(partial): calc(sink_partial_dmi_base 0x20000 + sink_dmi_offset)",
    "    · SBA 寻址(-trace-sba): calc(cluster_dmi_stride*(n_clusters+1) + sink_sba_dmi_offset 0x400)",
    "  其中 calc(dmi) = dmi_apb_base + dmi * dmi_scale(4);node_size = 0x1000。",
    "  预留追踪内存     = reserved_mem_start 0x450000000,大小 0x10000000(256MB,高端)。",
    "",
    "选择来源:auto 时由 generate_dts.py select_trace_config(cpu, platform) 拼出",
    "  ntrace_<家族>_v<版本>(版本取 platform-selection.csv 的 ntrace 列,家族取平台名);",
    "  -ntrace <本文件名 stem> 可强制指定(仅调试)。",
    "  若某 SoC 家族需改 apb/base 地址:新增 data/ntrace/ntrace_<家族>_v2.json 即可,零 Python。"
  ],
  "topology_model": "chained-dmi",
  "dmi_apb_base": "0x28000000",
  "dmi_scale": 4,
  "cluster_dmi_stride": "0x10000",
  "funnel2_dmi_offset": "0x400",
  "funnel1_dmi_base": "0xC00",
  "funnel1_dmi_core_stride": "0x800",
  "encoder_dmi_base": "0x800",
  "encoder_dmi_core_stride": "0x800",
  "sink_dmi_offset": {
    "smem": "0x400",
    "sram": "0x0",
    "pib": "0xC00"
  },
  "sink_sba_dmi_offset": "0x400",
  "sink_partial_dmi_base": "0x20000",
  "node_size": "0x1000",
  "reserved_mem_start": "0x450000000",
  "reserved_mem_size": "0x10000000",
  "default_sink_type": "smem"
}
